"New warp drive concept does twist space, doesn’t move us very fast","Enlarge/ The Enterprise, caught in the wake of a temporal vortex, witnesses the Earth, assimilated long ago, in the altered timeline. 
9
A team of physicists has discovered that its possible to bui… [+5318 chars]",https://arstechnica.com/science/2024/05/physicists-find-a-possible-way-to-get-warped-space-but-no-drive/
General Hospital spoilers: week of May 27-31,"If you want to take a look at what's coming up this week in Port Charles, or if you missed a story last week and need to see what happened, we've got you covered with our General Hospital spoilers fo… [+2100 chars]",https://www.whattowatch.com/news/general-hospital-spoilers-week-of-may-27-31
Deadly 2023 shooting outside North Linden Dollar General remains unsolved,"COLUMBUS, Ohio (WCMH) Columbus police are still searching for clues in a 2023 murder in which a man was shot outside a Dollar General store in northeast Columbus.
According to Columbus police, offic… [+977 chars]",https://www.nbc4i.com/news/local-news/columbus/deadly-2023-shooting-outside-north-linden-dollar-general-remains-unsolved/
"Target to cut court backlog cannot be met, says watchdog","The 2022 barristers' strike added to the backlogs that began before the pandemic
The governments target to reduce unprecedented criminal court backlogs in England and Wales cannot be met, the nation… [+3572 chars]",https://www.bbc.com/news/articles/cd110lr5lpno
Gething no confidence vote expected next week,"Gareth Lewis,Political editor, BBC Wales
Vaughan Gething looks set to face a Tory no confidence motion next week
Wales' First Minister Vaughan Gething looks set to face a vote of no confidence when… [+3577 chars]",https://www.bbc.com/news/articles/c6pp5j8ymm1o
Workers Party launches campaign with attack on Labour,"George Galloway has launched the Workers Party of Britain's general election campaign with an attack on Labour. 
He told supporters Labour leader Sir Keir Starmer was ""indistinguishable"" from Rishi … [+3149 chars]",https://www.bbc.com/news/articles/cxwwkrykv0zo
First Rwanda flight delayed until at least 24 July,"The government has told the High Court that it has delayed the possible start of sending some asylum seekers to Rwanda - casting further doubt on the timetable for the policy. 
Lawyers for the home … [+2830 chars]",https://www.bbc.com/news/articles/cd11jyl1ly4o
Sudanese army rejects call to end conflict in El Fasher,LONDON -- Sudanese army leaders are rejecting peace talks with the Rapid Support Forces paramilitary group following U.S Secretary of State Anthony Blinken's call with Sudanese Army Chief General Abd… [+2791 chars],https://abcnews.go.com/International/sudanese-army-rejects-calls-deescalate-fighting-el-fasher/story?id=110705450
The Rebirth of Queer Cruising Apps,"One night this past February, over drinks and moody bar lighting in Brooklyn, Eric Green and his friends were swapping stories of their recent hookups when one mentioned theyd used the app Sniffies t… [+3184 chars]",https://www.wired.com/story/the-rebirth-of-queer-cruising-apps-sniffies-bkdr-motto/
"Craig Wright Lied About Creating Bitcoin And Faked Evidence, Judge Rules","Weve seen a cascading effect from the pronouncement on a host of other litigations globally, says Grewal. For people outside of crypto, [all this] might sound cartoonish. But with Wrights claims fall… [+3320 chars]",https://www.wired.com/story/craig-wright-lied-faked-evidence-bitcoin-judge-says/
We Stood on Both Sides of the New York–Dublin Portal and It Was Glorious,"Amanda: I got to the Portal in Manhattans Flatiron District a little before 11 am New York time, and found that theres now a fence keeping people several feet away from it (but the same isnt happenin… [+2789 chars]",https://www.wired.com/story/new-york-dublin-portal-reopening/
/e/OS Review: This Operating System Is Better Than Android. You Should Try It,"Google's Android mobile operating system is open source, which means anyone can, in theory, build their own mobile operating system based on the Android Open Source Project (AOSP). Why, then, are the… [+2622 chars]",https://www.wired.com/story/e-os-review/
Wolves set to fail in bid to scrap Premier League VAR,"It is also understood there is unlikely to be a vote on Thursday around new financial rules, which are due to link squad costs to anchoring around broadcast income received by the league's lowest clu… [+1505 chars]",https://www.bbc.com/sport/football/articles/cv220k0jnrvo
Apple’s WWDC may include AI-generated emoji and an OpenAI partnership,"Apples WWDC may include AI-generated emoji and an OpenAI partnership
Apples WWDC may include AI-generated emoji and an OpenAI partnership
 / Apple is preparing to play its generative AI cards.
ByW… [+2585 chars]",https://www.theverge.com/2024/5/26/24165040/apple-wwdc-2024-ai-openai-ios-18-macos-15-iphone-macbook
Two brothers accused of stealing $25 million worth of crypto,"Two brothers accused of stealing $25 million worth of crypto
Two brothers accused of stealing $25 million worth of crypto
 / The heist took just 12 minutes to execute, prosecutors claim.
ByGaby De… [+2933 chars]",https://www.theverge.com/2024/5/16/24158398/crypto-ethereum-heist-peraire-bueno-brothers
"India's Modi could win third term, polls predict","Cherylann Mollan,BBC News, Mumbai
Mr Modi's BJP is on course to win the election, exit polls say
India's Prime Minister Narendra Modi is likely to win a third consecutive term in office, exit polls… [+3794 chars]",https://www.bbc.com/news/articles/cgllg541xmxo
GM to recycle ~10K tons of EV battery materials a year with Redwood deal,"Enlarge/ These minerals were once part of lithium-ion battery cells and will be once again.
2
Battery recycling company Redwood Materials will start recycling battery production scrap from General … [+1719 chars]",https://arstechnica.com/cars/2024/05/gm-to-recycle-10k-tons-of-ev-battery-materials-a-year-with-redwood-deal/
US actor shot dead during attempted car theft,"American actor Johnny Wactor has been shot dead in Los Angeles by a thief who was trying to steal a part from his car.
The 37-year-old suffered fatal injuries after interrupting three men who were a… [+1297 chars]",https://www.bbc.com/news/articles/cjrrn8nkj2do
Inside the Decision to Kill Iran’s Qassem Soleimani,Any assessment of the Middle East’s future must contend with an unpleasant fact: Iran remains committed to objectives that threaten both the region and U.S. interests. And those objectives are coming… [+22357 chars],https://www.theatlantic.com/ideas/archive/2024/05/qassem-soleimani-iran-middle-east/678472/?utm_source=feed
"We will not increase income tax or NI, Labour says","Ms Reeves promised there was ""not going to be a return to austerity"", saying commitments to boost frontline services were a ""down payment on the changes that we want to make"".
""But in the end we hav… [+1520 chars]",https://www.bbc.co.uk/news/uk-politics-69063581
Chelsea appoint Lyon's Bompastor as manager,"Women's Super League champions Chelsea have appointed Lyon boss Sonia Bompastor as their manager on a four-year deal.
Compensation has been agreed with the French club for the 43-year-old, who had a… [+1620 chars]",https://www.bbc.com/sport/football/articles/c2x3pv4vlzxo
Así fue como Corea del Norte ayudó a producir ‘Los Simpson’ en secreto,"Corea del Norte es conocida por ser un país del que todo el mundo quiere escapar, ya que todas las necesidades de la vida escasean allí. Como siempre sucede, mientras la población en general está con… [+6163 chars]",http://hipertextual.com/2024/05/asi-fue-como-corea-del-norte-ayudo-a-producir-los-simpson-en-secreto
Mort du premier receveur de greffe de rein de porc génétiquement modifié,"Des chirurgiens préparent un rein de porc génétiquement modifié pour la première greffe au monde dun rein de cette provenance sur un être humain vivant. Image du 16 mars 2024, fournie par le Massachu… [+1721 chars]",https://www.lemonde.fr/sante/article/2024/05/12/mort-du-premier-receveur-de-greffe-de-rein-de-porc-genetiquement-modifie_6232807_1651302.html
"Garland: Trump claim of DOJ, FBI plan to possibly assassinate him at MAL 'dangerous'",Attorney General Merrick Garland on Thursday slammed former President Donald Trump for insinuating President Joe Biden authorized his potential assassination during the FBI search of his Mar-a-Lago r… [+5484 chars],https://abcnews.go.com/Politics/garland-calls-trumps-false-claim-biden-doj-plan/story?id=110504598
Meet the Peaky Blinders - Ukraine's drone squad defending Kharkiv,"Jonathan Beale,Defence correspondent in Kharkiv
High-tech drones help Ukraine's defenders - but they need more support from allies
In the village of Lyptsi, Ukrainian forces appear to have blunted … [+8428 chars]",https://www.bbc.com/news/articles/cp0018dzg32o
