General Election called for 4 July,The Prime Minister is making a statement in Downing Street,https://www.bbc.co.uk/iplayer/episode/l0056mr0/general-election-called-for-4-july
General election campaigning under way in Wales,"Rishi Sunak called a general election on Wednesday 
Political parties have kicked started their campaigning for the general election. 
Prime Minister Rishi Sunak ended speculation on Wednesday, say… [+3322 chars]",https://www.bbc.com/news/articles/cxxxn5n09x5o
Former Tory MP backs Labour at general election,"Former Conservative MP Mark Logan has said he is backing Labour at the next general election, saying the party could ""bring back optimism into British life"". 
In an exclusive interview with BBC News… [+3091 chars]",https://www.bbc.com/news/articles/cd11kvk1je4o
Sunak announces UK general election for 4 July,"Prime Minister Rishi Sunak has called a summer UK general election to take place on Thursday 4 July.
He had been widely expected to wait until the autumn before triggering the poll, which does not l… [+665 chars]",https://www.bbc.co.uk/news/uk-politics-69050450
TikTok is testing AI-generated search results,"TikTok is testing AI-generated search results
TikTok is testing AI-generated search results
 / ChatGPT-generated results appear for some search queries, along with a more general search highlights … [+1917 chars]",https://www.theverge.com/2024/5/13/24155875/tiktok-ai-generated-search-results-highlights-chatgpt
Election 2024 Live,Follow continuing coverage of the 2024 General Election Campaign.,https://www.bbc.co.uk/iplayer/episode/l0056mwf/election-2024-live-election-2024-live
Election 2024 Live,Follow continuing coverage of the 2024 General Election Campaign.,https://www.bbc.co.uk/iplayer/episode/l0056myh/election-2024-live-election-2024-live
Election 2024 Live,Live Coverage of the General Election campaign for the 2024 election.,https://www.bbc.co.uk/iplayer/episode/l0056mvj/election-2024-live-election-2024-live
"Vote Plaid to keep Labour in check, leader says","Plaid Cymru's leader has said a vote for his party will keep the Conservatives ""out of Wales"" and also keep Labour ""in check"".
Speaking ahead of Plaid's general election campaign launch, Rhun ap Ior… [+996 chars]",https://www.bbc.com/news/articles/c0jjn4gk307o
Watch: Rishi Sunak's election announcement in full,"Prime Minister Rishi Sunak has announced a General Election that will take place on 4 July. 
Mr Sunak addressed the nation outside his residence on Downing Street, at a podium in the pouring rain. … [+71 chars]",https://www.bbc.co.uk/news/av/uk-politics-69051032
Sunak vows to fight on – but Tory MPs feel gloomy,"Rishi Sunak has said the general election result is ""not a foregone conclusion"", despite ""a disappointing"" set of local elections for the Tories.
Speaking to broadcasters for the first time since th… [+4052 chars]",https://www.bbc.co.uk/news/uk-politics-68965356
Watch: Election 2024 Live,Live Coverage of the General Election campaign for the 2024 election.,https://www.bbc.co.uk/iplayer/episode/l0056mr5/election-2024-live-election-2024-live
Usyk v Fury rematch set for December - Saudi official,"Undisputed heavyweight champion Oleksandr Usyk and Tyson Fury are set to meet in a rematch on 21 December, according to the chairman of Saudi Arabia's general entertainment authority.
Usyk beat Fury… [+993 chars]",https://www.bbc.com/sport/articles/c9eep4zlljpo
Labour pledges clean power push 'within months',"Labour would kickstart the creation of green energy projects across the country within months if elected, the party has said.
The party plans to create a publicly owned company, Great British Energy… [+3009 chars]",https://www.bbc.com/news/articles/c9xxpypr8d0o
£1.35 million staked on UK General Election within 24 hours,"Within 24 hours of the announcement of a UK General Election, £1.35 million ($1.72m) had been staked on Betfair’s Exchange election markets.
The sudden announcement made by incumbent Prime Minister … [+1983 chars]",https://readwrite.com/1-35-million-staked-on-uk-general-election-within-24-hours/
Former top US Army general in Europe calls Ukrainian complaints about the M1 Abrams tank 'BS',"M1A2 Abrams tank seen before a high-intensity training sessionArtur Widak/Anadolu Agency via Getty Images
<ul><li>Retired US Army general Mark Hertling challenged Ukrainian soldiers' criticisms of t… [+3306 chars]",https://www.businessinsider.com/former-us-general-rejects-criticism-from-ukrainians-of-abrams-tanks-2024-6
A 'cosmic glitch' in the universe is forcing astronomers to rethink Einstein's theory of relativity,"Albert Einstein's (left) general theory of relativity has been proven by countless studies of the nearby universe. But in deep space (right) it appears to glitch.MPI, Getty Images/NASA, ESA, CSA, STS… [+7315 chars]",https://www.businessinsider.com/cosmic-glitch-makes-scientists-rethink-einstein-greatest-theory-2024-5
OpenAI cofounder says AGI is coming fast — and needs some 'reasonable limits',"OpenAI launched GPT-4o this month.OpenAI
<ul><li>OpenAI's John Schulman says artificial general intelligence could be two to three years away.</li><li>Schulman emphasizes the need for tech companies… [+3259 chars]",https://www.businessinsider.com/openai-cofounder-agi-coming-fast-needs-limits-john-schulman-2024-5
Lack of staffing led to 'deeply concerning' conditions at federal prison in Oregon,"The main entrance to FCI Sheridan in Oregon.
Office of the Inspector General/Department of Justice
Delays for medical treatment at a federal prison in Oregon reached such a dire state that an inmat… [+4901 chars]",https://www.npr.org/2024/05/22/1252764293/sheridan-prison-staff-issues-doj-inspection
"Latinas are succeeding, but feel pressured to playing traditional roles for women",Angelica Popoca pours melted wax into a container. She recently quit her fulltime job to build her candle making venture. She now has more time to spend with her three children and enjoys running her… [+6589 chars],https://www.npr.org/2024/05/15/1251432972/latinas-women-career-homemakers-pew-hispanic
Justice Department says Merrick Garland can't be held in contempt by Congress,"Attorney General Merrick Garland
Win McNamee/Getty Images
The U.S. Justice Department on Thursday pushed back on House Republicans' plan to hold Attorney General Merrick Garland in contempt over th… [+1383 chars]",https://www.npr.org/2024/05/16/1251759154/garland-house-contempt
The General Intendant’s Daughter,"The girl’s expressive gifts surpass those of all the members of his company, even the aging starlet Klamt. That is something the General Intendant of the City Theater can no longer deny.Up to this po… [+18351 chars]",https://www.theatlantic.com/culture/archive/2024/05/adam-ehrlich-sachs-the-general-intendants-daughter/678335/?utm_source=feed
Images show what it's like to fall into a black hole,"Illustration of a black hole obliterating a planet.MARK GARLICK/SCIENCE PHOTO LIBRARY
<ul><li>A NASA video reveals in stunning detail what falling into a black hole would look like.</li><li>A NASA a… [+7620 chars]",https://www.businessinsider.com/fall-inside-black-hole-nasa-video-shows-what-looks-like-2024-5
"The US has been 'too passive' with the Houthis in the Red Sea and should go after their leaders, says retired US general","Guards during a protest backing the Houthis in Sana'a, Yemen, on March 22, 2024.Photo by Mohammed Hamoud/Getty Images
<ul><li>The US has been ""too passive"" in the Red Sea, a retired US general told … [+3156 chars]",https://www.businessinsider.com/us-passive-red-sea-should-strike-houthi-leaders-retired-general-2024-6
McDonald's just lost its chicken Big Mac trademark following a European court ruling,"McDonald's will no longer have the right to call its chicken burgers ""Big Macs"" in Europe following a court ruling.Patcharaporn Puttipon2465/Shutterstock
<ul><li>McDonald's lost its chicken Big Mac … [+2114 chars]",https://www.businessinsider.com/mcdonalds-chicken-big-mac-trademark-eu-court-ruling-supermacs-ireland-2024-6
"Indian authorities seize over $1 billion worth of illegal vote inducements, including drugs and cash, in country's elections","Election duty staff cast their votes on May 13, 2024, in Mumbai, India.Hindustan Times/ Getty Images
<ul><li>Indian authorities have seized over $1 billion in cash, drugs, and goods in the country's… [+2341 chars]",https://www.businessinsider.com/indian-authorities-seize-over-1bn-worth-drugs-cash-goods-2024
Watch as BBC reaches a hidden war’s jungle front line,"India's general election, the world's largest democratic exercise, is a long, colourful and visual affair.",https://www.bbc.com/news/videos/cxeevn4pe1jo
Secrecy Concerns Mount Over Spy Powers Targeting US Data Centers,"Last month, US president Joe Biden signed a surveillance bill enhancing the National Security Agencys power to compel US businesses to wiretap communications going in and out of the country. The chan… [+2928 chars]",https://www.wired.com/story/section-702-ecsp-civil-liberties-letter/
[Removed],[Removed],https://removed.com
Sunak sees the funny side of Downing Street soaking,"Prime Minister Rishi Sunak was meeting constituents in Northallerton when one remarked they thought he would be ""in bed with pneumonia"" after he was drenched by rain as he called the general election… [+133 chars]",https://www.bbc.com/news/videos/cw00j40djv8o
More than 100 business chiefs sign letter backing Labour,"Dozens of business leaders have signed a letter endorsing the Labour Partys economic plans ahead of the 4 July general election saying it is time for a change.
In a letter published in Tuesday's Tim… [+2138 chars]",https://www.bbc.com/news/articles/ckvv8qwl4y4o
House Republicans are ready to hold Attorney General Merrick Garland in contempt over Biden audio,"If you click 'Accept all', we and our partners, including 237 who are part of the IAB Transparency &amp; Consent Framework, will also store and/or access information on a device (in other words, use … [+678 chars]",https://consent.yahoo.com/v2/collectConsent?sessionId=1_cc-session_21648b9d-5417-4198-aaf4-707d2b770942
"'General Hospital's' Johnny Wactor killed in catalytic converter heist in downtown L.A., police say","If you click 'Accept all', we and our partners, including 238 who are part of the IAB Transparency &amp; Consent Framework, will also store and/or access information on a device (in other words, use … [+678 chars]",https://consent.yahoo.com/v2/collectConsent?sessionId=1_cc-session_e186df0d-b13d-4b51-91ae-faf020c5a22f
General Hospital spoilers: Anna spills the beans to Carly in frustration?,"We cant pretend that General Hospitals Anna (Finola Hughes) was ever a big fan of Carly (Laura Wright). After all, Carly once had a fierce rivalry with Annas daughter Robyn (Kimberly McCullough). How… [+3002 chars]",https://www.whattowatch.com/news/general-hospital-spoilers-anna-spills-the-beans-to-carly-in-frustration
Voters react to Vaughan Gething no-confidence vote,"Shelley Phelps,BBC Wales Westminster correspondent
Vaughan Gething says he will stay in post after losing the vote
One Labour candidate, who did not wish to be named, said they wanted to ""distance""… [+3422 chars]",https://www.bbc.com/news/articles/cyxxv1d1w0lo
Arizona Attorney General confirms Rudy Guiliani served indictment after taunting prosecutors,"Arizona Attorney General Kris Mayes (D) confirmed via social media that former New York City Mayor Rudy Giuliani had been served in the states 2020 election case against him.
The final defendant was… [+1430 chars]",https://thehill.com/regulation/court-battles/4671931-arizona-attorney-general-confirms-giuliani-served-indictment-after-taunting-prosecutors/
Woman facing charges after Farage milkshake incident,"A woman is facing an assault charge after a banana milkshake was thrown into Nigel Farage's face.
The Reform UK leader was leaving a pub in Clacton-on-Sea, Essex, on Tuesday having launched his gene… [+349 chars]",https://www.bbc.com/news/articles/cw0097xlqxvo
Crypto lender Genesis reaches $2B settlement,"The New York attorney general, Letitia James, has reached a groundbreaking $2 billion settlement with the bankrupt cryptocurrency lender Genesis Global, according to a May 20 announcement.
The settl… [+1536 chars]",https://readwrite.com/crypto-lender-genesis-reaches-2b-settlement/
Former Plaid MP Jonathan Edwards to stand down,"David Deans,Political reporter, BBC Wales News
Jonathan Edwards has been an MP since 2010
A former Plaid Cymru MP who accepted a police caution for assaulting his wife has announced he will not be … [+1736 chars]",https://www.bbc.com/news/articles/cljj4xpej9wo
Finals-bound Mavs reward GM with extension,"The Dallas Mavericks have signed general manager Nico Harrison to a multiyear contract extension.
The Mavericks announced the deal Tuesday, two days before they play the Boston Celtics in Game 1 of … [+1599 chars]",https://www.espn.com/nba/story/_/id/40275389/mavericks-gm-nico-harrison-signs-multiyear-contract-extension
Post Office convictions to be quashed as Paula Vennells gives final inquiry testimony,"Good morning and welcome to the third and last day of former Post Office CEO Paula Vennells giving evidence to the public inquiry into the sub-postmasters scandal. 
The last two days have revealed t… [+581 chars]",https://www.bbc.co.uk/news/live/uk-69056259
A top NATO general says Russian troops don't have the numbers or the skills to mount a strategic breakthrough in Kharkiv,"Russian military personnel at the Moscow Victory Day parade on May 9, 2024.Contributor via Getty Images
<ul><li>A top NATO general says Russia won't be able to achieve a ""strategic breakthrough"" in … [+2813 chars]",https://www.businessinsider.com/nato-russians-do-not-have-numbers-for-breakthrough-in-ukraine-2024-5
"Smith, winningest GM in Chargers' history, dies","May 12, 2024, 04:00 PM ET
Former Chargers general manager A.J. Smith died Sunday at the age of 75, his family announced.
Smith had been battling prostate cancer for the past seven years, his family… [+613 chars]",https://www.espn.com/nfl/story/_/id/40133269/aj-smith-winningest-gm-chargers-history-dies-75
Ohio Senate passes GOP-led Biden ballot access bill without Democrats' support,"As Ohio lawmakers convened on Tuesday for a special session to address President Joe Biden's ability to appear on their general election ballot in November, the Democratic National Committee said it … [+5786 chars]",https://abcnews.go.com/Politics/ohio-lawmakers-convene-special-session-ensure-biden-2024/story?id=110608254
"Nikki Haley won nearly 130,000 votes in the Indiana GOP primary. Here's what that means for Trump ahead of the general election.","Nikki Haley.George Frey/Getty Images
<ul><li>Donald Trump is on cruise control to formally win the GOP presidential nomination in Milwaukee.</li><li>But ex-UN Ambassador Nikki Haley continues to rac… [+3010 chars]",https://www.businessinsider.com/nikki-haley-trump-indiana-gop-primary-votes-2024-5
Japan's UK state visit to go ahead despite election,"Sean Coughlan,Royal correspondent
The state visit to the UK by the emperor and empress of Japan will go ahead later this month, says Buckingham Palace.
There had been speculation it would be postpo… [+3406 chars]",https://www.bbc.com/news/articles/cxww0e2xlnxo
Sunak to promise 'bold ideas' in pre-election pitch,"Rishi Sunak will say the UK ""stands at a crossroads"" ahead of ""some of the most dangerous years"", in a pre-election pitch to voters on Monday.
In a speech, the prime minister will argue his ""bold id… [+3208 chars]",https://www.bbc.co.uk/news/uk-politics-69000303
"Mexico Is So Hot, Monkeys Are Falling to Their Death From Trees","Since the 2000s, cacao production has declined, due to plant diseases and falling local prices, causing many people to turn their cacao farms into pasture. Valenzuela explains that this means that, i… [+2168 chars]",https://www.wired.com/story/mexico-is-so-hot-monkeys-are-falling-to-their-death-from-trees/
Astra Is Google's ‘Multimodal’ Answer to the New ChatGPT,"Pulkit Agrawal, an assistant professor at MIT who works on AI and robotics, says Google's and OpenAIs latest demos are impressive and show how rapidly multimodal AI models have advanced. OpenAI launc… [+2497 chars]",https://www.wired.com/story/google-io-astra-multimodal-answer-chatgpt/
"Sky, Carter confronted by individual at D.C. hotel","The Chicago Sky were confronted by an individual as they arrived at their team hotel in Washington, D.C. ahead of their Thursday tilt against the Mystics.
Sky general manager Jeff Pagliocca told the… [+1305 chars]",https://www.espn.com/wnba/story/_/id/40288404/sky-chennedy-carter-confronted-individual-team-hotel
What Nigel Farage Means for the U.K. Election,"Far right British politician Nigel Farage has launched a campaign for his eighth attempt at a seat in the U.K. House of Commons, a move that could lure Conservative voters to a new political home. 
… [+5856 chars]",https://time.com/6985435/nigel-farage-uk-election-campaign/
The US sues Ticketmaster for driving up live event fees,"The US sues Ticketmaster for driving up live event fees
The US sues Ticketmaster for driving up live event fees
 / The Department of Justices lawsuit seeks to break up Ticketmaster owner Live Natio… [+4337 chars]",https://www.theverge.com/2024/5/23/24163083/live-nation-ticketmaster-doj-monopoly-lawsuit-break-up
"Browns sign Stefanski, GM Berry to extensions","The Cleveland Browns have signed head coach Kevin Stefanski and general manager Andrew Berry to contract extensions, the team announced Wednesday, retaining the decision-making duo that has guided th… [+3231 chars]",https://www.espn.com/nfl/story/_/id/40283990/browns-sign-coach-kevin-stefanski-gm-andrew-berry-extensions
"Human Infected With Bird Flu in Michigan, Only the Second Case of Current Outbreak","The state of Michigan reported its first human case of H5N1, commonly called the bird flu, on Wednesday according to a press release from Michigan Health and Human Services. Its just the third human … [+2927 chars]",https://gizmodo.com/human-bird-flu-h5n1-michigan-outbreak-virus-milk-cows-1851494494
"Going, going, gone: Ed Davey takes a dip in Windermere",Sir Ed Davey fell into the water three times while paddleboarding on Lake Windermere. The Liberal Democrats leader was on a visit to Lake District with local candidate and former party leader Tim Far… [+569 chars],https://www.bbc.com/news/videos/cjkkn6pvgppo
Sunak to warn of 'dangerous years' in pre-election speech,"Welcome to the Sunak and Starmer show and welcome to the next four, five, six or seven months of your life.
Even if you pay only fleeting attention to the goings-on in UK politics, you have probably… [+510 chars]",https://www.bbc.co.uk/news/live/uk-politics-69001479
Sunak to face Starmer at Prime Minister's Questions,"Welcome to the Sunak and Starmer show and welcome to the next four, five, six or seven months of your life.
Even if you pay only fleeting attention to the goings-on in UK politics, you have probably… [+561 chars]",https://www.bbc.co.uk/news/live/uk-politics-69012669
"Sure, why not: China built a chatbot based on Xi Jinping","If you click 'Accept all', we and our partners, including 238 who are part of the IAB Transparency &amp; Consent Framework, will also store and/or access information on a device (in other words, use … [+678 chars]",https://consent.yahoo.com/v2/collectConsent?sessionId=1_cc-session_376efa5c-51b4-4125-bf13-942d693781e9
Biden asserts executive privilege over audio of interview with special counsel Hur,"The Justice Department on Thursday informed House Republicans that President Joe Biden has formally asserted executive privilege over the audio of his interview with special counsel Robert Hur, a mov… [+2198 chars]",https://abcnews.go.com/Politics/biden-asserts-executive-privilege-audio-interview-special-counsel/story?id=110298904
"VA improperly approved almost $11M in bonuses to senior executives, watchdog says","Department of Veterans Affairs officials improperly approved nearly $11 million in bonuses to senior executives intended for other workers, a department watchdog said in a new report.
The money was … [+1470 chars]",https://abcnews.go.com/Politics/va-improperly-approved-11m-bonuses-senior-executives-watchdog/story?id=110081569
"Alalshikh has big plans for Canelo, Crawford, Fury","NEW YORK -- His Excellency Turki Alalshikh, the chairman of Saudi Arabia's General Entertainment Authority, controls the biggest purse strings in boxing and says he plans to use that power to fix a s… [+10507 chars]",https://www.espn.com/boxing/story/_/id/40093719/turki-alalshikh-big-plans-canelo-crawford-fury
'General Hospital' actor Johnny Wactor dies at 37 after being shot in Los Angeles,"""General Hospital"" actor Johnny Wactor, who was known for playing Brando Corbin in the beloved ABC soap opera, died after being shot on Saturday.
Wactor was shot after he interrupted three male susp… [+1667 chars]",https://abcnews.go.com/GMA/Culture/general-hospital-actor-johnny-wactor-dies-37-after/story?id=110579838
Missouri attorney general race emerges as new front in GOP civil war,"The GOP civil war has reached a new beachhead: blood-red Missouri.
The state's Republican attorney general primary is pitting incumbent Andrew Bailey against Will Scharf, a lawyer for Donald Trump. … [+7295 chars]",https://abcnews.go.com/Politics/missouri-attorney-general-race-emerges-new-front-gop/story?id=110517175
Why General Electric just gave its workers the most elaborate employee handbook ever,"Most corporate gifts tend to be things like branded water bottles or, if youre lucky, a plaque. But to mark the end of General Electric as we know it, GE handed out what is possibly the most ornate e… [+2094 chars]",https://www.fastcompany.com/91123818/why-general-electric-just-gave-its-workers-the-most-elaborate-employee-handbook-ever-designed
Meta encourages you to disregard your seat mates and use VR headsets on a plane,"If you click 'Accept all', we and our partners, including 238 who are part of the IAB Transparency &amp; Consent Framework, will also store and/or access information on a device (in other words, use … [+678 chars]",https://consent.yahoo.com/v2/collectConsent?sessionId=1_cc-session_ff259c15-eb92-4518-b989-dd0bc753c120
[Removed],[Removed],https://removed.com
Leaders to hit the campaign trail as Gove steps down,"A short ceremony, involving a lot of hats and a smattering of French, ended business in Parliament for this session on Friday night, ahead of the general election.
A Royal Commission, made up of fiv… [+938 chars]",https://www.bbc.co.uk/news/live/uk-politics-69059992
Bank holiday weather: Rain or shine?,"Meteorological spring continues for another week and it looks as if temperatures will climb a little further after Monday. 
The general outlook is that we will keep a south-westerly wind and that it… [+906 chars]",https://www.bbc.com/weather/articles/c5115n3gx1do
"Lib Dems pledge to hire 8,000 extra GPs if elected","Sam Francis,Political Reporter 
The Liberal Democrats have pledged to recruit 8,000 more GPs if elected, putting the policy at ""the heart"" of their general election campaign offer.
Sir Ed Davey, th… [+2786 chars]",https://www.bbc.com/news/articles/cy66901gz3po
"How Google's AI Overviews Work, and How to Turn Them Off (You Can't)","When can you expect your query to trigger an AI-generated summary of the results? AI Overviews appear for complex queries, says Mallory De Leon, a Google spokesperson. You'll find AI Overviews in you… [+2953 chars]",https://www.wired.com/story/google-ai-overviews-how-to-use-how-to-turn-off/
Burnout Is Pushing Workers to Use AI—Even if Their Boss Doesn’t Know,"White-collar workers are so overwhelmed with emails, web chats, and meetings that they are using AI tools to get their jobs doneeven if their companies havent trained them to do so, according to a wo… [+2938 chars]",https://www.wired.com/story/ai-workers-burnout-microsoft-linkedin/
Biden's New Import Rules Will Hit Ebike Batteries Too,"Last week, the Biden administration announced it would levy dramatic new tariffs on electric vehicles, electric vehicle batteries, and battery components imported into the United States from China. T… [+3682 chars]",https://www.wired.com/story/biden-tariffs-ebike-batteries/
Election in Indonesia Presents a Challenge for the U.S.,Indonesia's President-elect Prabowo Subianto (left) speaks to reporters with Vice President-elect Gibran Rakabuming Raka (second left) as they arrive at the plenary session of the General Elections C… [+559 chars],https://www.npr.org/2024/05/10/1196980865/election-in-indonesia-presents-a-challenge-for-the-u-s
Nikki Haley Says She Will Vote for Donald Trump,"COLUMBIA, S.C. Nikki Haley said Wednesday that she will be voting for Donald Trump in the general election, encouraging the presumptive GOP nominee to work hard to win support from those who backed h… [+808 chars]",https://time.com/6981228/nikki-haley-vote-donald-trump/
The pub where Eisenhower and Patton made D-Day plans over dinner,"Gen George S Patton was based in Cheshire ahead of the D-Day landings
""D-Day tomorrow. Everybody quite excited. We land at Arromanches, clear three villages and Bayeux.""
Discovered in a dusty upsta… [+6173 chars]",https://www.bbc.com/news/articles/cjqq7zw5g27o
